فاصوليا	f aː sˤ uː l i j aː
مشعاع	m i ʃ ʕ aː ʕ
اجتماعي	i d͡ʒ t i m aː ʕ i j j
بنجنكشت	b a n d͡ʒ a n k u ʃ t
لاذ	l aː ð a
تريث	t a r a j j a θ a
يابس	j aː b i s
أنبج	ʔ a m b i d͡ʒ
مكدس	m u k a d d a s
مايو	m aː j uː
المنامة	a l m a n aː m a
مغسلة	m a ɣ s a l a
استفراغ	i s t i f r aː ɣ
كراويا	k a r aː w i j aː
استمنى	i s t a m n aː
جنب	d͡ʒ a n a b
أعقد	ʔ a ʕ q a d
ابتلاش	i b t i l aː ʃ
مأمأة	m a ʔ m a ʔ a
بواب	b a w w aː b
أبيدجان	ʔ a b iː d d͡ʒ aː n
مرآة	m i r ʔ aː h
إبعاد	ʔ i b ʕ aː d
صيد	sˤ a j d
فاكهة	f aː k h a
استغاث	i s t a ɣ aː θ a
جوهري	d͡ʒ a w h a r i j j
تصدير	t a sˤ d iː r
تحوط	t a ħ a w w a tˤ a
دستوري	d u s t uː r i j j
سرنديب	s a r a n d iː b
العراق	a l ʕ i r aː q
محادث	m u ħ aː d a θ
عربن	ʕ a r b a n a
خادم	x aː d i m
مستقبلي	m u s t a q b a l i j j
ثرب	θ a r b
جبت	d͡ʒ i b t
عانى	ʕ aː n aː
كلب	k a l b
شحن	ʃ a ħ a n a
انتقم	i n t a q a m a
شامخ	ʃ aː m i x
عظمى	ʕ u ðˤ m aː
خيار	x i j aː r
اجتاز	i d͡ʒ t aː z a
قونية	q uː n i j a
أصفهان	ʔ a sˤ f a h aː n
شراع	ʃ i r aː ʕ
أجوف	ʔ a d͡ʒ w a f
زرقطونا	z a r q a tˤ uː n aː
رزتاق	r u z t aː q
عافية	ʕ aː f i j a
تذاكى	t a ð aː k aː
عسكر	ʕ a s k a r
طرشي	tˤ u r ʃ i j j
متكبر	m u t a k a b b i r
سطام	s i tˤ aː m
شهاب	ʃ i h aː b
إيا	ʔ i j j aː
هندس	h a n d a s a
صاج	sˤ aː d͡ʒ
درزن	d a r z a n
مطار	m a tˤ aː r
بطارخ	b a tˤ aː r i x
صيدلة	sˤ a j d a l a
اعتزام	i ʕ t i z aː m
جعفيل	d͡ʒ a ʕ f iː l
غفر	ɣ a f a r a
شاذ	ʃ aː ð ð
حالة	ħ aː l a
أخامص	ʔ a x aː m i sˤ
تفرغ	t a f a r r a ɣ a
حوجلة	ħ a w d͡ʒ a l a
واحة	w aː ħ a
محطة	m a ħ a tˤ tˤ a
رمم	r a m m a m a
أنتم	ʔ a n t u m
لعبة	l a ʕ b a
الإنجيل	a l ʔ i n d͡ʒ iː l
مرشد	m u r ʃ i d
رضوخ	r u dˤ uː x
خرس	x a r a s a
عريان	ʕ u r j aː n
شاشية	ʃ aː ʃ i j j a
جسم	d͡ʒ a s s a m a
سلامة	s a l aː m a
تمساح	t i m s aː ħ
إنقاض	ʔ i n q aː dˤ
ببنودة	b a b n uː d a
شرق	ʃ a r q
تايوان	t aː j w aː n
ترنح	t a r a n n a ħ a
بورتسودان	b uː r t s uː d aː n
لهي	l a h i j a
مرو	m a r w
حرق	ħ a r a q a
عصب	ʕ a sˤ a b a
خباز	x a b b aː z
واطن	w aː tˤ a n a
مخفر	m a x f a r
أكاذيب	ʔ a k aː ð iː b
بوسة	b a w s a
احتكار	i ħ t i k aː r
صأكة	sˤ a ʔ k a
براعة	b a r aː ʕ a
حيران	ħ a j r aː n
ليل	l a j l
أناغاليس	ʔ a n aː ɣ aː l iː s
رستاق	r u s t aː q
ضمور	dˤ u m uː r
شبع	ʃ a b i ʕ a
نقيض	n a q iː dˤ
ماثل	m aː θ a l a
قدم	q a d a m
طموحات	tˤ u m uː ħ aː t
فاقة	f aː q a
ندوات	n a d a w aː t
لهذا	l i h aː ð aː
ضبط	dˤ a b a tˤ a
ليث	l a j θ
نافى	n aː f aː
بقرة	b a q a r a
روض	r a w w a dˤ a
مدة	m a d d a
مسى	m a s aː
عبيثران	ʕ a b a j θ a r aː n
غالب	ɣ aː l i b
وسق	w a s q
أدهش	ʔ a d h a ʃ a
جهادي	d͡ʒ i h aː d i j j
إسرنج	ʔ i s r i n d͡ʒ
خشاب	x a ʃ ʃ aː b
باحث	b aː ħ a θ a
نفاذ	n a f aː ð
إسماعيل	ʔ i s m aː ʕ iː l
تناقض	t a n aː q a dˤ a
فالوذق	f aː l uː ð a q
عمروسة	ʕ a m r uː s a
برن	b i r n
أغلب	ʔ a ɣ l a b
تفاح	t u f f aː ħ
تخدر	t a x a d d a r a
تيش	t iː ʃ
توزيع	t a w z iː ʕ
صقنقور	sˤ a q a n q uː r
إفادة	ʔ i f aː d a
دارفلفل	d aː r f i l f i l
خصص	x a sˤ sˤ a sˤ a
توازى	t a w aː z aː
عطاء	ʕ a tˤ aː ʔ
غناء	ɣ i n aː ʔ
استقبال	i s t i q b aː l
سقم	s a q a m
خارج	x aː r i d͡ʒ
فهم	f a h h a m a
قبرة	q u b b a r a
أنعم	ʔ a n ʕ a m
سخبر	s a x b a r
شيردال	ʃ iː r d aː l
شريعة	ʃ a r iː ʕ a
استنفد	i s t a n f a d a
مرحبا	m a r ħ a b aː
يافوخ	j aː f uː x
رادود	r aː d uː d
مراسل	m u r aː s i l
انفتح	i n f a t a ħ a
بخص	b a x a sˤ
محراث	m i ħ r aː θ
هود	h a w d
شبوطة	ʃ a b b uː tˤ a
جنيف	d͡ʒ i n iː f
تقية	t a q i j j a
تقني	t i q n i j j
كندس	k u n d u s
أنضب	ʔ a n dˤ a b a
وغد	w a ɣ d
شيرة	ʃ a j r a
فيروس	f a j r uː s
سعي	s a ʕ j
إعلان	ʔ i ʕ l aː n
وسد	w a s s a d a
سلجم	s a l d͡ʒ a m
كفى	k a f aː
حنجري	ħ a n d͡ʒ a r i j j
أنواع	ʔ a n w aː ʕ
تسعون	t a s ʕ a w n a
مفاجأة	m u f aː d͡ʒ a ʔ a
مسطرة	m i s tˤ a r a
اعتلى	i ʕ t a l aː
رحيل	r a ħ iː l
صرب	sˤ a r a b a
بقر	b a q a r
الذي	a l l a ð iː
حافة	ħ aː f a
قابل	q aː b a l a
أنواط	ʔ a n w aː tˤ
قبو	q a b w
صاع	sˤ aː ʕ
جلاد	d͡ʒ a l l aː d
أبلس	ʔ a b l a s a
وعليكم	w a ʕ a l a j k u m
مازريون	m aː z a r i j uː n
دهنج	d a h n a d͡ʒ
منذ	m u n ð u
مشاعر	m a ʃ aː ʕ i r
ولاية	w a l aː j a
نظام	n i ðˤ aː m
تحاشى	t a ħ aː ʃ aː
غيظ	ɣ a j ðˤ
فقس	f a q a s a
ميثاق	m iː θ aː q
عجاوة	ʕ u d͡ʒ aː w a
ناقص	n aː q i sˤ
أجرب	ʔ a d͡ʒ r a b
نقطة	n u q tˤ a
دستة	d a s t a
استفسار	i s t i f s aː r
نبرة	n a b r a
ناجذ	n aː d͡ʒ i ð
خرطال	x a r tˤ aː l
كذين	k u ð iː n
خوذة	x uː ð a
عاشب	ʕ aː ʃ i b
باطية	b aː tˤ i j a
فقاعة	f u q q aː ʕ a
صغير	sˤ a ɣ iː r
إطراء	ʔ i tˤ r aː ʔ
تعلة	t a ʕ i l l a
إرادي	ʔ i r aː d i j j
القاهرة	a l q aː h i r a
بحر	b a ħ a r
شعبية	ʃ a ʕ b i j j a
بند	b a n d
حدوة	ħ a d w a
سلافي	s l aː f i j j
احتضن	i ħ t a dˤ a n a
طيرة	tˤ a j r a
أسطوري	ʔ u s tˤ uː r i j j
عسبق	ʕ a s b a q
صمام	sˤ i m aː m
أوحل	ʔ a w ħ a l a
قشمير	q i ʃ m iː r
معاوية	m u ʕ aː w i j a
تلم	t a l a m
كأب	k a ʔ b
سطح	s a tˤ ħ
زوفا	z uː f aː
ظربان	ðˤ a r i b aː n
متصل	m u t t a sˤ i l
ساحلي	s aː ħ i l i j j
ينسون	j a n s uː n
رقم	r a q m
أسترالي	ʔ u s t u r aː l i j j
انشقاق	i n ʃ i q aː q
رفاهة	r a f aː h a
جعضيض	d͡ʒ a ʕ dˤ iː dˤ
ذكاء	ð a k aː ʔ
كافتيريا	k aː f i t iː r i j aː
حصل	ħ a sˤ a l
شقة	ʃ a q q a
شعيب	ʃ u ʕ a j b
مضض	m a dˤ a dˤ
عنقاد	ʕ i n q aː d
مداخلة	m u d aː x a l a
قبيلة	q a b iː l a
نساب	n a s s aː b
ألهى	ʔ a l h aː
دفلى	d i f l aː
عابس	ʕ aː b i s
متخلف	m i t x a l l a f
ثريد	θ a r iː d
ستارة	s i t aː r a
قيصر	q a j sˤ a r
ترنيم	t a r n iː m
اتحاد	i t t i ħ aː d
مسطار	m i s tˤ aː r
غلا	ɣ a l aː
دماغ	d i m aː ɣ
مسيح	m a s iː ħ
إيجار	ʔ iː d͡ʒ aː r
مطب	m a tˤ a b b
خرقة	x i r q a
مرجان	m a r d͡ʒ aː n
المغرب	a l m a ɣ r i b
مراوغة	m u r aː w a ɣ a
ارتخى	i r t a x aː
بولاد	b uː l aː d
تليس	t a l l iː s
دهس	d a h a s a
أسماء	ʔ a s m aː ʔ
ردد	r a d d a d a
محترف	m u ħ t a r i f
سماء	s a m aː ʔ
تقيؤ	t a q a j j u ʔ
تخفيض	t a x f iː dˤ
مقلق	m u q l i q
اشتهى	i ʃ t a h aː
صخيد	sˤ a x iː d
دشداشة	d i ʃ d aː ʃ a
مذهبي	m a ð h a b i j j
قرد	q a r d
قيمة	q iː m a
عندما	ʕ i n d a m aː
قفازات	q u f f aː z aː t
فاض	f aː dˤ a
عظيم	ʕ a ðˤ iː m
فودنج	f uː d a n a d͡ʒ
مضمون	m a dˤ m uː n
قنبيل	q a n b iː l
زراعي	z i r aː ʕ i j j
نطل	n a tˤ a l a
اتصال	i t t i sˤ aː l
زائر	z aː ʔ i r
تجارة	t i d͡ʒ aː r a
معجزات	m u ʕ d͡ʒ i z aː t
ناعم	n aː ʕ i m
أنكر	ʔ a n k a r a
ثيوقراطي	θ i j uː q r aː tˤ i j j
هذر	h a ð a r a
نفث	n a f a θ a
طلب	tˤ a l a b
أمير	ʔ a m iː r
إدحية	ʔ i d ħ i j a
وصيد	w a sˤ iː d
أشل	ʔ a ʃ a l l
حوول	ħ uː w i l a
حبارى	ħ u b aː r aː
نحن	n a ħ n i
غرب	ɣ a r a b
تذكرة	t a ð k i r a
حبق	ħ a b a q
غرامة	ɣ a r aː m a
بواليع	b a w aː l iː ʕ
انتماء	i n t i m aː ʔ
ياسين	j aː s iː n
خزينة	x a z iː n a
مقاعد	m a q aː ʕ i d
استعمل	i s t a ʕ m a l a
ميعاد	m iː ʕ aː d
فوج	f a w d͡ʒ
شاء	ʃ aː ʔ
هرولة	h a r w a l a
خاطئ	x aː tˤ i ʔ
عروس	ʕ a r uː s
رابط	r aː b i tˤ
رهبانية	r a h b aː n i j j a
طائفة	tˤ aː ʔ i f a
أنهك	ʔ a n h a k a
قاوق	q aː w u q
بامية	b aː m i j a
وابور	w aː b uː r
دولاب	d a w l aː b
مسيحي	m a s iː ħ i j j
باطس	b aː tˤ u s
مقشدة	m i q ʃ a d a
جلس	d͡ʒ a l a s a
أغيد	ʔ a ɣ j a d
صرق	sˤ a r a q
رفأ	r a f a ʔ a
مظلة	m a ðˤ a l l a
جائز	d͡ʒ aː ʔ i z
بغيض	b a ɣ iː dˤ
كوالا	k u w aː l aː
كارة	k aː r a
إيران	ʔ iː r aː n
اعتقاد	i ʕ t i q aː d
ريح	r a j j a ħ a
استمات	i s t a m aː t a
خرفة	x u r f a
سلاف	s u l aː f
أسف	ʔ a s a f f a
فأس	f a ʔ s
سلوى	s a l w aː
كسرة	k a s r a
خوف	x a w f
حنان	ħ a n aː n
معاينة	m u ʕ aː j a n a
استهجان	i s t i h d͡ʒ aː n
عوائد	ʕ a w aː ʔ i d
ثورة	θ a w r a
زنباع	z a n b aː ʕ
مقطعية	m a q tˤ a ʕ i j j a
أثث	ʔ a θ θ a θ a
شيهم	ʃ a j h a m
ضجيج	dˤ a d͡ʒ iː d͡ʒ
عزيز	ʕ a z iː z
خابور	x aː b uː r
مرأة	m a r ʔ a
راجل	r aː d͡ʒ i l
إلحاق	ʔ i l ħ aː q
أبنوس	ʔ a b a n uː s
اعتل	i ʕ t a l l a
كعبة	k a ʕ b a
شهترج	ʃ a h t a r a d͡ʒ
صابورة	sˤ aː b uː r a
بكرج	b a k r a d͡ʒ
طبقة	tˤ a b a q a
غضة	ɣ a dˤ dˤ a
فيثاغورس	f iː θ aː ɣ uː r a s
قنص	q a n a sˤ a
سريان	s a r a j aː n
طليعة	tˤ a l iː ʕ a
مجموع	m a d͡ʒ m uː ʕ
هذيان	h a ð a j aː n
عجب	ʕ a d͡ʒ a b
براين	b r aː j a n
فتخاء	f a t x aː ʔ
خلية	x a l i j j a
مروض	m u r a w w a dˤ
نفخ	n a f a x a
عرزال	ʕ i r z aː l
حظيرة	ħ a ðˤ iː r a
استجاب	i s t a d͡ʒ aː b a
فرضية	f a r a dˤ i j j a
باكستاني	b aː k i s t aː n i j j
تفاف	t i f aː f
صحرة	sˤ u ħ r a
عربز	ʕ a r b a z
دركي	d a r a k i j j
أساس	ʔ a s aː s
تخم	t a x m
الآخرة	a l ʔ aː x i r a
دقع	d a q i ʕ a
اقترح	i q t a r a ħ a
فاكرة	f aː k i r a
لهجة	l a h d͡ʒ a
نرويجية	n u r w iː d͡ʒ i j j a
أبد	ʔ a b a d
ملوكية	m u l uː k i j j a
كزبرة	k u z b a r a
صتع	sˤ a t a ʕ a
عقدة	ʕ u q d a
شليل	ʃ a l iː l
جندب	d͡ʒ u n d u b
سمن	s a m i n a
إرتريا	ʔ i r i t r i j aː
منفاخ	m i n f aː x
توجه	t a w a d͡ʒ d͡ʒ a h a
شلال	ʃ a l l aː l
صفد	sˤ a f a d
ظهر	ðˤ a h a r a
إهداء	ʔ i h d aː ʔ
مغرفة	m i ɣ r a f a
بريطاني	b a r iː tˤ aː n i j j
ذعن	ð a ʕ i n a
سكران	s a k r aː n
سلسل	s a l s a l a
جمجمة	d͡ʒ u m d͡ʒ u m a
بندق	b u n d u q
ذئب	ð i ʔ b
صحل	sˤ a ħ i l a
شاكرة	ʃ aː k i r a
جاورجيوس	d͡ʒ aː w u r d͡ʒ i j uː s
قلقطار	q a l q a tˤ aː r
استوقف	i s t a w q a f a
أدحوة	ʔ u d ħ u w w a
قروش	q u r uː ʃ
كاعب	k aː ʕ i b
ملجأ	m a l d͡ʒ a ʔ
بوذية	b uː ð i j j a
عانس	ʕ aː n i s
رجع	r a d͡ʒ a ʕ a
أعيا	ʔ a ʕ j aː
أحد	ʔ a ħ a d
جخى	d͡ʒ a x x aː
فراء	f a r aː ʔ
انجذاب	i n d͡ʒ i ð aː b
رأي	r a ʔ j
ظليم	ðˤ a l iː m
حدق	ħ a d a q a
سخيف	s a x iː f
مباراة	m u b aː r aː h
فالوذة	f aː l uː ð a
عدد	ʕ a d a d
قطران	q a tˤ a r aː n
نملة	n a m l a
فتح	f a t a ħ a
سيكولوجي	s a j k uː l uː d͡ʒ i j j
بعلة	b a ʕ l a
شارع	ʃ aː r i ʕ
ورشنوفة	w a r ʃ a n uː f a
جانرك	d͡ʒ aː n a r i k
احترق	i ħ t a r a q a
قرنبيط	q a r n a b iː tˤ
جدار	d͡ʒ i d aː r
رسغ	r u s ɣ
مئذنة	m i ʔ ð a n a
ساحة	s aː ħ a
كدس	k a d a s a
إشفى	ʔ i ʃ f aː
أنضج	ʔ a n dˤ a d͡ʒ a
إداري	ʔ i d aː r i j j
منتخب	m u n t a x a b
المريخ	a l m i r r iː x
جبان	d͡ʒ a b aː n
مريمية	m a r j a m i j j a
ردم	r a d a m a
مرددوش	m a r d a d uː ʃ
رابع	r aː b i ʕ
غمود	ɣ u m uː d
قاوون	q aː w uː n
زنباعة	z a n b aː ʕ a
أفغانستان	ʔ a f ɣ aː n i s t aː n
بهشية	b a h a ʃ i j j a
مصفاة	m i sˤ f aː h
استنتاج	i s t i n t aː d͡ʒ
اكترى	i k t a r aː
لاحم	l aː ħ i m
اتسم	i t t a s a m a
مثلث	m u θ a l l a θ
تضاد	t a dˤ aː d d a
إلكترونيات	ʔ i l i k t r uː n i j j aː t
فيج	f a j d͡ʒ
إفرند	ʔ i f r i n d
تراب	t u r aː b
سهول	s u h uː l
أبهج	ʔ a b h a d͡ʒ a
بلور	b i l l a w r
أرغان	ʔ a r ɣ aː n
تبغ	t a b ɣ
احتفال	i ħ t i f aː l
شنع	ʃ a n n a ʕ a
مرقد	m a r q a d
بهائي	b a h aː ʔ i j j
سقيفة	s a q iː f a
أرثوذكسي	ʔ u r θ uː ð u k s i j j
النيجر	a n n iː d͡ʒ a r
جبيز	d͡ʒ a b iː z
ذهب	ð a h a b
وقت	w a q a t
شهادة	ʃ a h aː d a
تمهيد	t a m h iː d
غافث	ɣ aː f a θ
مركب	m a r k a b
نعجة	n a ʕ d͡ʒ a
فقري	f i q r i j j
وقع	w a q a ʕ a
دراسي	d i r aː s i j j
محيط	m u ħ iː tˤ
لاءم	l aː ʔ a m a
ندم	n a d a m
ارادہ	ʔ ɪ ɽ a: d ə
جدیدترین	d͡ʒ a d iː d t a r iː n
دکن	d ʊ k n
رامو	ɽ a: m ʊ
موٹر	m oː ʈ ɽ
دیویندر	d eː ʋ iː n d ɽ
واریرس	ʋ aː ɽ iː ɽ s
اٹارنی	a: ʈ a: r n iː
بہت	b ə ɦ ʊ t
اتوار	ɪ t ʋ a: ɽ
مٹانا	m ɪ ʈ a: n a:
منہ	m ʊ ɦ
تھم	t ɦ ə m
بااثر	b a: ʔ s ɛ ɽ
سازش	s a: z ɪ ʃ
شماری	ʃ ʊ m a: ɽ iː
چھال	t͡ʃʰ a: l
خسارہ	x ɪ s a: ɽ a: ɦ
انعام	ɪ n a aː m
مشروب	m a ʃ r uː b
خطا	x ə t a:
ارب	ə ɽ ə b
قومیت	q ɔː m ɪ j j ə t
غیرمستحکم	ɣ ɪ r m ʊ s t ɦ a k a m
نرمان	n ɪ ɽ m a: n
ابھشیک	ə bʰ ɪ ʂ eː k
رجوران	r ə d͡ʒ ʊ r a: n
ڈیسک	ɖ iː s k
سلاح	s ɪ l a:
رنگولی	ɽ ə ŋ ɡ oː l iː
سلجوق	s ə l d͡ʒ uː q
جوا	d͡ʒ ʊ a:
ذ	z
آکاش	a: k a: ʃ
جشن	d͡ʒ ə ʃ ə n
ہیکہ	ɦ eː k ɦ
ہمسفر	ɦ ə m s ə f ə ɽ
تہجی	t ə ɦ ə d͡ʒʰ iː
حقارت	ɦ ʊ q a: ɽ ə t
جنم	d͡ʒ ə n m
بادل	b a: d ə l
دھرنہ	dʰ ʊ r n a
مسئلہ	m ə s l a:
پہ	p eː
خاموش	x a: m oː ʃ
اسٹائسٹکس	ɪ s ʈ a: ɪ s ʈ k s
یکجا	j ə k d͡ʒ aː
ایشیا	a: ɪ ʃ iː a:
بالے	b a: l eː
کھانا	kʰ a: n a:
فلورنگ	f l ɔː r n ɪ ŋ
گرنا	ɡ ɪ ɽ n a:
فلاحی	f l a: ɦ iː
پریدا	p ə r iː d a:
تمھیں	t ʊ m e:
مکواوگر	m a k ʋ a: ʋ ɡ ə ɽ
سکو	s k uː
گانا	ɡ a: n a:
دعوہ	d ʊ ʔ a:
سفر	s ə f ə ɽ
رویئہ	ɽ ə ʋ ə i a:
گود	ɡ uː d
لوتھ	l oː tʰ
استفسار	a s t a f s aː r
واجبی	ʋ aː d͡ʒ b iː
میزان	m iː z a: n
نافذ	n a: f ɪ z
پار	p a: ɽ
اودبلاؤ	uː d b ɪ l a: oː
مودی	m uː d iː
باشندہ	b a: ʃ ɪ n d a:
راجو	ɽ a: d͡ʒ oː
گرجا	ɡ ɪ ɽ d͡ʒ a:
القرآن	a l q ʊ r aː n
بھروسہ	bʰ ə ɽ oː s a:
جامعہ	d͡ʒ a: m ɪ ʔ a:
کسی	k ə s iː
ٹریژری	ʈ r iː ʒ ɛ r iː
ٹانگ	ʈ a: ŋ ɡ
تحدید	t ə ɦ d iː d
خاصا	x a: s a:
رمضان	ɽ ə m z a: n
محمد	m ʊ ɦ ə m m ə d
پالیسی	p a: l iː s iː
کارگزاری	k a: r ɡ ʊ z a: r iː
آلنگن	a: l ɪ ŋ ɡ ə n
سمیع	s ə m iː a
سنگھ	s ɪ ŋ ɡʰ
اردو	ʊ ɽ d uː
یت	ɪ j ə t
ندیو	n ə d ɪ j oː
ریمارک	r eɪ m a: r k
پرکاش	p ɽ ə k a: ʃ
سیاست	s ɪ j a: s ə t
رکشا	ɽ ə k ʂ a:
باقاعدہ	b a: q a: ɪ d a:
گروداس	ɡ ə r uː d a: s
چال	t͡ʃ a: l
جاہی	d͡ʒ a: ɦ iː
صفرواں	s ɪ f ə ɽ ʋ a:
برادرنسبتی	b ɽ a: d ə r n ɪ s b ə t iː
رسالہ	ɽ ɪ s a: l a:
رب	ɽ ə b
بشرط	b ə ʃ ɽ ʈ
ملازم	m ʊ l a: z ə m
اختیارکردہ	ə x t iː j aː ɽ k ə ɽ d ə ɦ
مرد	m ə ɽ d
کھاگ	kʰ a: ɡ
غنڈہ	ɣ ʊ n ɖ a:
دیواکر	d iː ʋ a: k ə ɽ
شرائط	ʃ ʊ r a: ɪ ʈ
ویژن	ʋ iː ʒ ə n
ربوہ	ɽ ə b ʋ a: ɦ
سداسیوپیٹ	s ʊ d a: s j oː p iː ʈ
ریکٹر	ɽ eː k t ɽ
ماک	m a: k
داردر	d a: ɽ ɪ d ɽ
پہلا	p ə ɦ l a:
بنوکلب	b ə n oː k l a b
شائنی	ʃ a: ɪ n iː
راجا	ɽ a: d͡ʒ a:
ارغوانی	ə ɽ ɣ ʋ a: n iː
درس	d ə r s
کتراپی	k ʊ t ɽ a: p iː
بیدر	b iː d r
ڈھيٹھ	ɖʰ iː ʈʰ
سترویں	s t ɽ oː ʋ eː n
بھونگیر	bʰ ʊ ŋ ɡ iː r
شریک	ʃ a r iː k
ابوغریب	a: b ʊ ɣ ɽ iː b
ڈیفنس	ɖ iː f n ɪ s
رسٹورنٹس	ɽ ə s ʈ ɔː ɽ ə n ʈ s
خنجر	x ə n d͡ʒ ə ɽ
آبسٹیٹرکس	a: b s ʈ iː ʈ ɪ ɽ k s
انت	ə n t
ترپاٹھی	t ə ɽ p a: tʰ iː
دستبردار	d ʊ s t b ɛ r d a: r
جگر	d͡ʒ ə ɡ ə r
جانی	d͡ʒ a: n iː
آزمودہ	a: z m uː d ə
پیلاگو	p iː l aː ɡ oː
روٹس	r ɔː ʈ s
چوڑائی	t͡ʃ ɔː ɽ a: iː
پولیت	p oː l iː t
شروع	ʃ ʊ ɽ uː a
ڈگیس	ɖ ɪ ɡ iː s
ورزش	ʋ ə ɽ z ɪ ʃ
پینل	p eː n l
فٹچ	f t͡ʃ
پارٹنرشپ	p a: r t n ɛ r ʃ ɪ p
پیغام	p eː ɡ a: m
پستہ	p ɪ s t a:
فتنہ	f ə t n ə
مسافر	m ʊ s a: f ɪ ɽ
خوراک	x ʊ ɽ a: k
گودھرا	ɡ oː dʰ ɽ aː
سختی	s a x t iː
چابھی	t͡ʃ a: bʰ iː
قلندر	q ə l ə n d ə ɽ
کوہیر	k oː ɦ iː ɽ
آبادی	a: b a: d iː
اکرام	a: k r a: m
اودا	uː d a:
عابد	ʔ a: b ɪ d
پریم	p ɽ eː m
جمیعتہ	d͡ʒ ʊ m iː a a: t a:
غیرضروری	ɣ eː ɽ z ə ɽ uː ɽ iː
ڈر	ɖ ə ɽ
پڑھ	p ɽʰ
ایرانی	iː ɽ a: n iː
چاہت	t͡ʃ a: ɦ ə t
ایشیائی	a: iː ʃ iː a: iː
مانچسٹر	m a: t͡ʃ ə s ʈ ə ɽ
پرابین	p ə ɽ aː b iː n
انگلانگ	ɪ ŋ ɡ l a: ŋ ɡ
بہار	b ə ɦ a: ɽ
کارنامہ	k aː r n aː m ə
نثار	n ɪ s a: r
بہشت	b ɪ ɦ ɪ ʃ t
نتجہ	n ə t d͡ʒ ə ɦ
لاشعوری	l a: ʃ eː ʋ oː ɽ iː
ڈمرو	ɖ ə m ɽ uː
ملکہ	m ə l ɪ k a:
شہد	ʃ ə ɦ d
کمیشن	k a m iː ʃ a n
سہمانا	s ə ɦ m a: n a:
وسلم	ʋ ʊ s l ʊ m
عکس	a k s
مند	m ʊ n d
ندی	n ə d iː
مہیندرا	m ə ɦ iː n d r a:
ققنس	q ə q n ʊ s
افتتاح	ə f t t a: ɦ
بنجر	b ʊ n d͡ʒ ɛ r
مینار	m iː n aː r
النکرت	ə l ə ŋ k ɽ ɪ t
پنا	p ə n n a:
روپوش	r uː p oː ʃ
کڑپہ	k a r p a
شاہی	ʃ a: ɦ iː
شائق	ʃ a: ɪ q
فرانس	f ɽ a: n s
سوادو	s ʋ a: d uː
تکنیکی	t a k n iː k iː
تڑت	t ə ɽ ɪ t
ایرانڈیا	a iː r aː n d iː aː
فعالیت	f a a: l iː t
تدبیر	t ə d b iː ɽ
نتائج	n ɪ t aː ɪ d͡ʒ
ٹیکسی	ʈ iː k s iː
مباحثہ	m ʊ b aː ɦ a tʰ a
مناسبت	m ə n aː s b ə t
خودکش	x ʊ d k ʊ ʃ
پجاری	p ʊ d͡ʒ a: r iː
روپیا	ɽ uː p iː a:
خصوص	x ʊ s uː s
افق	a: f ə q
عمر	a m r
عجائب	ə d͡ʒ a: ɪ b
تیسری	t eː s r iː
پشاور	p e ʃ a: ʋ ə ɽ
اردن	a: r d ə n
جٹا	d͡ʒ ə ʈ a:
ژالہ	ʒ a: l ə
لمپٹ	l ə m p ə ʈ
موسم	m ɔː s ə m
پیشاب	p eː ʃ a: b
میاتھمیٹکس	m j a: tʰ m iː ʈ ɪ k s
تھیلا	tʰ iː l a:
بینچ	b iː n t͡ʃ
وظیفدار	ʋ ʊ z iː f d a: ɽ
سموسہ	s ə m oː s a:
دلیری	d ə l iː ɽ iː
لیبرمن	l iː b ə r m ə n
ٹرینس	ʈ ɽ eː n s
پرتبھا	p ə r t ʊ bʰ a:
بدلوانا	b ə d ə l ʋ a: n a:
معمولی	m ʊ ʔ m ʊ l iː
تاپنا	t a: p n a:
زخم	z ə x m
ایماندار	iː m a: n d a: ɽ
سلامی	s ə l aː m iː
پجرنا	p ə d͡ʒ ɽ n a:
یورانیم	j ʊ ɽ aː n iː m
وانچو	ʋ a: n t͡ʃ oː
پورکر	p u: r k ə r
گجنی	ɡ ʊ d͡ʒ n iː
ہاں	ɦ a:
بستی	b ə s t iː
مہلوک	m ə ɦ l oː k
پرفل	p ə ɽ f l
عبری	ɪ b ɽ iː
کاٹ	k a: ʈ
انٹرنیشنل	ɪ n ʈ ə r n iː ʃ ə n ə l
پرنسپل	p ə ɽ n s p ə l
لیگ	l iː ɡ
قابض	q a: b ɪ z
بادشاہت	b a: d ʃ a: ɦ ə t
مئی	m eː ɪ
حالانکہ	ɦ a: l a: k iː
آسان	a: s a: n
فورا	f ɔː ɽ ə n
آسمانی	a: s m a: n iː
دیکشت	d iː k ʃ t
کشتی	k ə ʃ t iː
لاکھ	l a: kʰ
نور	n ʊ r
ایتھنز	iː tʰ ə n z
طوطی	ʈ ɔː ʈ iː
بھارت	bʰ a: ɽ ə t
ڈسمبر	ɖ ə s m b ə ɽ
لڑکی	l ə ɽ k iː
ہوٹل	ɦ oː ʈ ə l
کنگارو	k ə ŋ ɡ a: ɽ uː
کھانی	kʰ a: n iː
جڑ	d͡ʒ ə ɽ
آگ	aː ɡ
حجام	ɦ ə d͡ʒ d͡ʒ a: m
پرندہ	p ə ɽ ɪ n d a:
اطباء	ɪ t ɪ b a: a:
بوتھا	b oː tʰ a:
مالیت	m a: l iː t
کوبائلوبہ	k ʋ ʊ b a: iː l ʋ ʊ b a:
گز	ɡ ʊ z
جوس	d͡ʒ oʊ s
تال	t a: l
وسنت	ʋ ʊ s n a t
نمائند	n ʊ m aː ɪ n d
میزبان	m eː z b a: n
فیڈنگ	f iː d ɪ ŋ ɡ
ڈاکٹر	ɖ a: k ʈ ə ɽ
بھراتا	bʰ ɽ a: t a:
مخبر	m ʊ x b ɪ ɽ
مسلح	m ʊ s l ɛ ɦ
عنب	ɪ n eː b
کشیدہ	k a ʃ iː d a:
کروانا	k ə ɽ ʋ a: n a:
نصیب	n ə s iː b
باربروسہ	b a: r b ə r oː s ə
گے	ɡ eː
مسجد	m ə s d͡ʒ ɪ d
شجرکاری	ʃ ʊ d͡ʒ r k a: r iː
کلکٹر	k ʊ l k ʈ ɛ ɽ
کھیلنا	kʰ eː l n a:
کالجس	k a: l d͡ʒ ə s
کھجور	kʰ ə d͡ʒ uː ɽ
سری	s ɽ iː
اوباما	ɔː b a: m a:
کیول	k eː ʋ ə l
جھوٹ	d͡ʒ ʱ uː ʈ
گزشتہ	ɡ ʊ z ʃ t ɦ
ناظرہ	n a: z ɪ ɽ ə
چوبے	t͡ʃ oː b eː
ادھنا	ə dʰ ʊ n a:
دینا	d eː n a:
آکسیجن	a: k s iː d͡ʒ ə n
اشتراکیت	ɪ ʃ t e ɽ a: k ɪ j ə t
غم	ɣ ə m
جیش	d͡ʒ æː ʃ
سیما	s iː m a:
پرجا	p ɛ ɽ d͡ʒ a:
شراب	ʃ ə ɽ a: b
رنگاریڈی	ɽ ə ŋ ɡ a: ɽ iː d iː
ش	ʃ
عوامی	a ʋ aː m iː
سلیکٹر	s ʊ l iː k ʈ ɛ ɽ
کرکٹرس	k ɪ r k ɪ t ɽ ʊ s
بادامی	b a: d a: m iː
انڈیوگونزیلویس	a n ɖ iː ʋ a ɡ a n z iː l a ʋ iː s
دعائے	d̪ʊ a: ɪ eː
لیکچرر	l iː k t͡ʃ ə ɽ ɽ
سونا	s uː n a:
فارسی	f a: ɽ s iː
اولا	oː l a:
برسر	b ə r s ə r
نبردآزما	n ə b ɽ d a: z m a:
کمپیوٹر	k a m p j uː ʈ ə ɽ
حافظ	ɦ a: f ɪ z
فیریرو	f eɪ r iː r oʊ
رد	ɽ ə d d
چاٹ	t͡ʃ a: ʈ
مصارف	m ʊ s a: ɽ ɪ f
لرزاں	l ə ɽ z a:
کورٹ	k ɔː r ʈ
تحقیقی	t ə ɦ ə q iː q iː
سؤر	s uː ə ɽ
نصاریٰ	n ə s a: ɽ a:
ڈوگر	ɖ oː ɡ ɛː ɽ
ریاستہا	ɽ ɪ j a: s ə t ɦ a:
میٹرس	m eː t ə r s
سنگین	s ʊ ŋ ɡ iː n
پرسوں	p ə ɽ s o:
ہندوستان	ɦ ɪ n d ʊ s t a: n
دلی	d ɪ l iː
تھکا	tʰ ə k a:
گلال	ɡ ʊ l a: l
گرجنا	ɡ ə ɽ ə d͡ʒ n a:
کیمیا	k iː m ɪ j a:
قلعہ	q ɪ l a:
آرڈر	a: ɽ ʈ ɽ
اسوسی	ɪ s ʊ s iː
یونیورسٹی	j uː n iː ʋ a r s ʈ iː
بنجارا	b ə n d͡ʒ a: ɽ a:
دفنانا	d ə f n a: n a:
اختتام۔پزیر	a: x t t a: m p ə z iː ɽ
تیاگ	t j a: ɡ
گرمکھی	ɡ ʊ ɽ m ʊ kʰ iː
گین	ɡ eː n
میٹابولائز	m eː ʈ a: b oː l aː ɪ z
الجھن	ʔ ə l d͡ʒ ʱ ʊ n
عام	a: m
کمبلے	k ə m b l eː
کاشف	k a: ʃ f
تنازعہ	t ə n a: z a ɦ
آزادی	a: z a: d iː
کونکنی	k uː n k n iː
سنور	s ɪ n ʋ ɔː ɽ
سرمئی	s ʊ ɽ m ə iː , s ə ɽ m ə iː
کارڈ	k a: ɽ d
سپلی	s ə p l iː
رائے	ɽ a: j
عطر	ʔ ɪ t ɽ
سنگاپور	s ɪ ŋ ɡ a: p uː ɽ
بند	b ə n d
شام	ʃ a: m
فلک	f ə l ə k
بشکل	b ʊ ʃ k ə l
دباؤ	d ə b a: oː
چھاڑ	t͡ʃʰ a: ɽ
ڈسٹرکٹ	ɖ ɪ s ʈ r ɪ k ʈ
ارجنٹائن	ə ɽ d͡ʒ ə n ʈ a: iː n
نتیجتا	n ə t iː d͡ʒ ə t ə n
گردی	ɡ ʊ r d iː
ایل	a: ɪ l
بورن	b ɔː ɽ n
دھول	dʰ uː l
سڑک	s ə ɽ ə k
ایمان	iː m a: n
آسرا	a: s ɽ a:
چوٹ	t͡ʃ oː ʈ
وصولی	ʋ ʊ s uː l iː
ہے	ɦ ɛː
طوفان	t uː f a: n
سونگھ	s uː ŋ ɦ
نالے	n a: l eː
گھرانا	ɡʰ ə ɽ a: n a:
جیوتی	d͡ʒ j oː t iː
کھیل	kʰ eː l
ماریشیس	m a: r iː ʃ iː s
مستحکم	m ʊ s t a ɦ k a m
جاسوس	d͡ʒ a: s uː s
جرأت	d͡ʒ ʊ ɽ ɽ ə t
اکانٹس	ə k a: n ʈ s
جرثومہ	d͡ʒ ʊ ɽ s uː m a:
دھیریہ	dʰ ɛː ɽ j
بابرہ	b a: b ɽ a:
تازہ	t a: z a:
پڑھنا	p ə ɽʰ n a:
اخبار	ə x b a: ɽ
مباین	m ʊ b a: j n
ڈابسن	ɖ a: b s ə n
بچپن	b ə t͡ʃ p ə n
انجام	ə n d͡ʒ a: m
نظرانداز	n ʊ z ɽ a: n d a: z
مقبوض	m ə q b uː z
کرشمہ	k ə ɽ ɪ ʃ m a:
مراکیش	m ɽ a: k ɛː ʃ
راکھ	ɽ a: kʰ
تاناشاہی	t a: n a: ʃ a: ɦ iː
سائمن	s a: ɪ m ʊ n
احتمال	eː ɦ t eː m a: l
ئن	ʔ ɪ n
جائپھل	d͡ʒ a: ɪ pʰ ə l
قبض	q ə b ə z
غیر	ɣ ɛː ɽ
مے	m ɛː
اناج	a: n a: d͡ʒ
خون	x uː n
اپنيتر	ʊ p n eː t ɽ
ہماہمی	ɦ ə m a: ɦ ə m iː
پوٹےشیم	p oʊ ʈ eɪ ʃ iː m
مجھ	m ʊ d͡ʒʰ
فریقی	f ə r iː q iː
انحراف	ɪ n ɦ ɪ r a: f
بہن	bʰ ɛː n
نسل	n ə s l
پستان	p ɪ s t a: n
علامہ	a ə l aː m ə
الاسد	ə l a: s d
انگور	ə n ɡ uː ɽ
آیئنا	a: iː ə n ə
بہاؤالدین	b ə ɦ a: ʔ ʊ d d iː n
حکمرانی	ɦ ʊ k ʊ m ɽ a: n iː
تگنا	t ɪ ɡ n a:
بوریت	b oː ɽ ɪ j ə t
متواتر	m ʊ t ʋ a: t ɽ
جیبھ	d͡ʒ iː bʰ
ذات	z a: t
چاہیئے	t͡ʃ a: ɦ iː ɛ
ادی	ə d j
بلین	b ɛː l iː n
زنانی	z ʊ n a: n iː
