آئین	ɑː iː n
آبادی	ɑː b ɑː d̪ iː
آبشار	ɑː b ʃ ɑː ɾ
آبی	ɑː b iː
آتما	ɑː t̪ m ɑː
آج	ɑː d͡ʒ
آخرت	ɑː x ɪ ɾ ə t̪
آدمی	ɑː d̪ m iː
آدھا	ɑː d̪ʱ ɑː
آدھنک	ɑː d̪ʱ ʊ n ɪ k
آذربائیجان	ɑː z ə ɾ b ɑː ɪ d͡ʒ ɑː n
آرام	ɑː ɾ ɑː m
آرزو	ɑː ɾ z uː
آریامن	ɑː ɾ j ə m ə n
آزادی	ɑː z ɑː d̪ iː
آزمانا	ɑː z m ɑː n ɑː
آزمودہ	ɑː z m uː d ə
آس	ɑː s
آسام	ɑː s ɑː m
آستین	ɑː s t̪ iː n
آسرا	ɑː s ɾ ɑː
آسمانی	ɑː s m ɑː n iː
آسٹریا	ɔː s ʈ ɾ ɪ j ɑː
آسکت	ɑː s ə k t̪
آسیب	ɑː s eː b
آغوش	ɑː ɣ oː ʃ
آفت	ɑː f ə t̪
آفریدی	ɑː f ɾ iː d̪ iː
آلس	ɑː l ə s
آلسی	ɑː l s iː
آلنگن	ɑː l ɪ ŋ ɡ ə n
آلودگی	ɑː l uː d̪ ə ɡ iː
آمریت	ɑː m ɪ ɾ ɪ j ə t̪
آموزش	ɑː m oː z ɪ ʃ
آمیزش	ɑː m eː z ɪ ʃ
آنا	ɑː n ɑː
آندھی	ɑː n d̪ʱ iː
آنسو	ɑ̃ː s uː
آنکھ	ɑ̃ː kʰ
آواز	ɑː ʋ ɑː z
آوشيکتا	ɑː ʋ ə ʃ j ə k t̪ ɑː
آٹھواں	ɑː ʈʰ ʋ ɑ̃ː
آپ	ɑː p
آکاش	ɑː k ɑː ʃ
آکرشت	ɑː k ə ɾ ʂ ɪ t̪
آکرمن	ɑː k ɾ ə m ə ɳ
آکھیٹ	ɑː kʰ eː ʈ
آگار	ɑː ɡ ɑː ɾ
آیا	ɑː j ɑː
ابابیل	ə b ɑː b iː l
ابهار	ʊ bʱ ɑː ɾ
ابو	ə b b uː
ابٹن	ʊ b ʈ ə n
ابھشیک	ə bʱ ɪ ʂ eː k
اتحاد	ɪ t̪ː ɪ ɦ ɑː d̪
اتحادی	ɪ t̪ t̪ ɪ ɦ ɑː d̪ iː
اترنا	ʊ t̪ ə ɾ n ɑː
اتصال	ɪ t̪ t̪ ɪ s ɑː l
اتفاق	ɪ t̪ t̪ ɪ f ɑː q
اتوار	ɪ t̪ ʋ ɑː ɾ
اتھان	ʊ t̪ t̪ʰ ɑː n
اثبات	ɪ s b ɑː t̪
اجازت	ɪ d͡ʒ ɑː z ə t̪
اجالا	ʊ d͡ʒ ɑː l ɑː
اجالنا	ʊ d͡ʒ ɑː l n ɑː
اجنبی	ə d͡ʒ n ə b iː
اجوائن	ə d͡ʒ ʋ ɑː ɪ n
اجگر	ə d͡ʒ ɡ ə ɾ
احباب	ə ɦ b ɑː b
احتجاج	eː ɦ t̪ ɪ d͡ʒ ɑː d͡ʒ
احترام	e ɦ t̪ ɪ ɾ ɑː m
احتمال	eː ɦ t̪ eː m ɑː l
احسان	ə ɦ ə s ɑː n
احمق	ə ɦ m ə q
اخاہ	ə xː ɑː
اخبار	ə x b ɑː ɾ
اخذ	ə x z
اخروٹ	ə x ɾ oː ʈ
اخلاق	ə x l ɑː q
ادا	ə d̪ ɑː
اداس	ʊ d̪ ɑː s
اداسی	ʊ d̪ ɑː s iː
اداہرن	ʊ d̪ ɑː ɦ ɾ ə ɳ
ادبیات	ə d̪ b ɪ j ɑː t̪
ادھار	ʊ d̪ʱ ɑː ɾ
ادھنا	ə d̪ʱ ʊ n ɑː
ادھورا	ə d̪ʱ uː ɾ ɑː
ادی	ə d̪ jᵊ
ارب	ə ɾ ə b
ارتعاش	ɪ ɾ t̪ eː ɑː ʃ
ارجت	ə ɾ d͡ʒ ɪ t̪
ارجن	ə ɾ d͡ʒ ʊ n
ارجنٹائن	ə ɾ d͡ʒ ə n ʈ ɑː iː n
اردو	ʊ ɾ d̪ uː
ارسطو	ə ɾ ə s t̪ uː
ارش	ə ɾ ʃ
ارغوانی	ə ɾ ɣ ʋ ɑː n iː
ارمان	ə ɾ m ɑː n
ارے	ə ɾ eː
از	ə z
ازدواج	ɪ z d̪ ɪ ʋ ɑː d͡ʒ
استری	ɪ s t̪ ɾ iː
استعمال	ɪ s t̪ eː m ɑː l
استقبال	ɪ s t̪ ɪ q b ɑː l
استنبول	ɪ s t̪ ə m b oː l
اسرائیل	ɪ s ɾ ɑː iː l
اسلام	ɪ s l ɑː m
اسم	ɪ s m
اشارہ	ɪ ʃ ɑː ɾ ɑː
اشبھ	ə ʃ ʊ bʱ
اشبیلیہ	ə ʃ b iː l ɪ j ɑː ɦ
اشتراکیت	ɪ ʃ t̪ e ɾ ɑː k ɪ j ə t̪
اشتقاق	ɪ ʃ t̪ ɪ q ɑː q
اشتمالیت	ɪ ʃ t̪ e m ɑː l ɪ j ə t̪
اصطبل	ə s t̪ ə b ə l
اصل	ə s ə l
اصلاح	ɪ s l ɑː ɦ
اصول	ʊ s uː l
اصیل	ə s iː l
اضافہ	ɪ z ɑː f ə
اضطراری	ɪ z t̪ ɪ ɾ ɑː ɾ iː
اطالیہ	ɪ t̪ ɑː l ɪ j ɑː ɦ
اطفال	ə t̪ f ɑː l
اطلاقی	ɪ t̪ l ɑː q iː
اطلس	ə t̪ l ə s
اطمینان	ɪ t̪ m iː n ɑː n
اغوا	ɪ ɣ ʋ ɑː
افزائش	ə f z ɑː ɪ ʃ
افسانہ	ə f s ɑː n ə
افغانستان	ə f ɣ ɑː n ɪ s t̪ ɑː n
افق	ɑː f ə q
افلاس	ɪ f l ɑː s
اقامت	ɪ q ɑː m ə t̪
اقتصادی	ɪ q t̪ ɪ s ɑː d̪ iː
اللہ	ə l l ɑː ɦ
الم	ə l ə m
الماس	ə l m ɑː s
النکار	ə l ə ŋ k ɑː ɾ
النکرت	ə l ə ŋ k ɾ ɪ t̪
الوداع	ə l ʋ ɪ d̪ ɑː
الگ	ə l ə ɡ
امتحان	ɪ m t̪ ɪ ɦ ɑː n
امداد	ɪ m d̪ ɑː d̪
امرود	ə m ɾ uː d̪
امن	ə m ə n
امی	ə m m iː
انار	ə n ɑː ɾ
انارکلی	ə n ɑː ɾ k ə l iː
انت	ə n t̪
انتخاب	ɪ n t̪ ɪ x ɑː b
انتظار	ɪ n t̪ ɪ z ɑː ɾ
انتظام	ɪ n t̪ ɪ z ɑː m
انتظامی	ɪ n t̪ ɪ z ɑː m iː
انتم	ə n t̪ ɪ m
انتہاپسند	ɪ n t̪ e ɦ ɑː p ə s ə n d̪
انجام	ə ɲ d͡ʒ ɑː m
انجانا	ə n d͡ʒ ɑː n ɑː
اندلس	ʊ n d̪ ʊ l ʊ s
اندیکھا	ə n d̪ eː kʰ ɑː
انسان	ɪ n s ɑː n
انش	ə n ʃ
انقلاب	ɪ n q ɪ l ɑː b
انپم	ə n ʊ p ə m
انڈا	ə ɳ ɖ ɑː
انڈکوش	ə ɳ ɖ ə k oː ʃ
انڈیا	ɪ n ɖ ɪ j ɑː
انگریزی	ə̃ ŋ ɡ ɾ eː z iː
انگلستان	ɪ ŋ ɡ l ɪ s t̪ ɑː n
انگلی	ʊ ŋ ɡ l iː
انگلینڈ	ɪ ŋ ɡ l ɛː n ɖ
انگور	ə n ɡ uː ɾ
انگوری	ə ŋ ɡ uː ɾ iː
انگوٹھا	ə ŋ ɡ uː ʈʰ ɑː
انھیں	ʊ nʱ ẽː
انہ	ɑː n ɑː
انہیں	ʊ n ɦ ẽː
اهہ	ɪ ɦ
اودا	uː d̪ ɑː
اودبلاؤ	uː d̪ b ɪ l ɑː oː
اودھی	ə ʋ ə d̪ʱ iː
اور	ɔː ɾ
اوسطا	ɔː s t̪ ə n
اوقات	ɔː q ɑː t̪
اول	ə ʋ ʋ ə l
اولا	oː l ɑː
اونٹ	ũː ʈ
اوہ	uː ɦ
اٹاچی	ə ʈ ɛː t͡ʃ iː
اپاہج	ə p ɑː ɦ ɪ d͡ʒ
اپدهان	ʊ p d̪ʱ ɑː n
اپرادھی	ə p ɾ ɑː d̪ʱ iː
اپریل	ə p ɾ ɛː l
اپستھت	ʊ p ə s t̪ʰ ɪ t̪
اپلبدھ	ʊ p l ə b d̪ʱ
اپنيتر	ʊ p n eː t̪ ɾᵊ
اچانک	ə t͡ʃ ɑː n ə k
اچت	ʊ t͡ʃ ɪ t̪
اچھا	ə t͡ʃ t͡ʃʰ ɑː
اڑان	ʊ ɽ ɑː n
اڑیوا	ə ɽ eː ʋ ɑː
اژدہا	ə ʒ d̪ ə ɦ ɑː
اکثر	ə k s ə ɾ
اکیلا	ə k eː l ɑː
اگر	ə ɡ ə ɾ
اگربتی	ə ɡ ə ɾ b ə t̪ t̪ iː
اگرچہ	ə ɡ ə ɾ t͡ʃ eː
اگلا	ə ɡ l ɑː
ایت	ə j ʊ t̪
ایتھنز	iː t̪ʰ ə n z
ایجنٹ	eː d͡ʒ ə ɳ ʈ
ایران	iː ɾ ɑː n
ایرانی	iː ɾ ɑː n iː
ایشور	iː ʃ ʋ ə ɾ
ایمان	iː m ɑː n
ایماندار	iː m ɑː n d̪ ɑː ɾ
اینٹورپن	ɛː n ʈ ʋ ə ɾ p ə n
ایوان	ɛː ʋ ɑː n
بائیسکل	b ɑː iː s ɪ k ə l
بات	b ɑː t̪
بادام	b ɑː d̪ ɑː m
بادامی	b ɑː d̪ ɑː m iː
بادشاہ	b ɑː d̪ ʃ ɑː ɦ
بادشاہت	b ɑː d̪ ʃ ɑː ɦ ə t̪
بادل	b ɑː d̪ ə l
بارش	b ɑː ɾ ɪ ʃ
بازو	b ɑː z uː
باشندہ	b ɑː ʃ ɪ n d̪ ɑː
باغ	b ɑː ɣ
بال	b ɑː l
بالکل	b ɪ l k ʊ l
بانچنا	b ɑ̃ː t͡ʃ n ɑː
باٹ	b ɑː ʈ
باہوبلی	b ɑː ɦ ʊ b ə l iː
ببھکشا	b ʊ bʱ ʊ k ʂ ɑː
بت	b ʊ t̪
بتانا	b ɪ t̪ ɑː n ɑː
بجلی	b ɪ d͡ʒ l iː
بحر	b ə ɦ ɾ
بددعا	b ə d̪ d̪ ʊ ɑː
بدر	b ə d̪ ə ɾ
بدلنا	b ə d̪ ə l n ɑː
بدلوانا	b ə d̪ ə l ʋ ɑː n ɑː
بدن	b ə d̪ ə n
بدھیا	b ə d̪ʱ ɪ j ɑː
برتن	b ə ɾ t̪ ə n
برسلز	b ɾ ə s ə l z
برما	b ə ɾ m ɑː
برمنگھم	b ə ɾ m ɪ n ɡʱ ə m
بروخے	b ɾ uː x eː
برچھا	b ə ɾ t͡ʃʰ ɑː
برچھیت	b ə ɾ t͡ʃʰ ɛː t̪
برکت	b ə ɾ k ə t̪
برکها	b ə ɾ kʰ ɑː
بزرگ	b ʊ z ʊ ɾ ɡ
بستی	b ə s t̪ iː
بطخ	b ə t̪ː ə x
بظاہر	b ə z ɑː ɦ ɪ ɾ
بغير	b ə ɣ ɛː ɾ
بقرعید	b ə q ɾ iː d̪
بلا	b ʊ l l ɑː
بلغاریہ	b ʊ l ɣ ɑː ɾ ɪ j ɑː
بلکہ	b ə l k iː
بمبہ	b ə m bᵊ
بناوٹی	b ə n ɑː ʋ ə ʈ iː
بنتی	b ɪ n t̪ iː
بنجارا	b ə n d͡ʒ ɑː ɾ ɑː
بند	b ə n d̪
بندر	b ə n d̪ ə ɾ
بنزین	b ə n z iː n
بنفشی	b ə n ə f ʃ iː
بنيان	b ə n ɪ j ɑː n
بهنجك	bʱ ə n d͡ʒ ə k
بهیس	bʱ eː s
بوریت	b oː ɾ ɪ j ə t̪
بولنا	b oː l n ɑː
بونا	b ɔː n ɑː
بوڑھا	b uː ɽʱ ɑː
بٹورنا	b ə ʈ oː ɾ n ɑː
بپتسمہ	b ə p t̪ ɪ s m ɑː
بچپن	b ə t͡ʃ p ə n
بڑا	b ə ɽ ɑː
بکاؤ	b ɪ k ɑː uː
بکرا	b ə k ɾ ɑː
بکری	b ə k ɾ iː
بکس	b ə k s
بکم	b ʊ k m
بکھراو	b ɪ kʰ ɾ ɑː ʋ
بھائی	bʱ ɑː iː
بھاجن	bʱ ɑː d͡ʒ ə n
بھارت	bʱ ɑː ɾ ə t̪
بھاروپیہ	bʱ ɑː ɾ oː p ɪ j ɑː
بھاشا	bʱ ɑː ʂ ɑː
بھالو	bʱ ɑː l uː
بھانگ	bʱ ɑː ŋ ɡ
بھراتا	bʱ ɾ ɑː t̪ ɑː
بھرن	bʱ ə ɾ ə n
بھروسہ	bʱ ə ɾ oː s ɑː
بھوت	bʱ uː t̪
بھوتنی	bʱ uː t̪ ɪ n iː
بھورا	bʱ uː ɾ ɑː
بھوک	bʱ uː k
بھکت	bʱ ə k t̪
بھکتی	bʱ ə k t̪ iː
بھگدڑ	bʱ ə ɡ d̪ ə ɽ
بھگوان	bʱ ə ɡ ʋ ɑː n
بھی	bʱ iː
بھید	bʱ eː d̪
بہاؤالدین	b ə ɦ ɑː ʔ ʊ d̪ d̪ iː n
بہار	b ə ɦ ɑː ɾ
بہاراں	b ə ɦ ɑː ɾ ɑ̃ː
بہت	b ə ɦ ʊ t̪
بہتر	b ə ɦ ə t̪ t̪ ə ɾ
بہشت	b ɪ ɦ ɪ ʃ t̪
بہن	bʱ ɛː n
بہنا	b ɛ ɦ n ɑː
بیلاروس	b eː l ɑː ɾ uː s
بیوی	b iː ʋ iː
بیچ	b iː t͡ʃ
تاجکستان	t̪ ɑː d͡ʒ ɪ k ɪ s t̪ ɑː n
تار	t̪ ɑː ɾ
تازہ	t̪ ɑː z ɑː
تاشقند	t̪ ɑː ʃ q ə n d̪
تال	t̪ ɑː l
تاناشاہ	t̪ ɑː n ɑː ʃ ɑː ɦ
تاناشاہی	t̪ ɑː n ɑː ʃ ɑː ɦ iː
تاپنا	t̪ ɑː p n ɑː
تاڑ	t̪ ɑː ɽ
تاڑی	t̪ ɑː ɽ iː
تبادلہ	t̪ ə b ɑː d̪ ɪ l ɑ ɦ
تبریز	t̪ ə b ɾ eː z
تتلی	t̪ ɪ t̪ l iː
ترانه	t̪ ə ɾ ɑː n ə
ترجمان	t̪ ə ɾ d͡ʒ ʊ m ɑː n
ترجمہ	t̪ ə ɾ d͡ʒ ʊ m ɑː
ترجیح	t̪ ə ɾ d͡ʒ iː ɦ
ترٹی	t̪ ɾ ʊ ʈ iː
ترکی	t̪ ʊ ɾ k iː
تسلیم	t̪ ə s l iː m
تشنہ	t̪ ɪ ʃ n ɑː
تعداد	t̪ ə ʔ d̪ ɑː d̪
تفصیل	t̪ ə f s iː l
تقریباً	t̪ ə q ɾ iː b ə n
تكميل	t̪ ə k m iː l
تلخ	t̪ ə l̪ ə x
تلخی	t̪ ə l x iː
تلوار	t̪ ə l ʋ ɑː ɾ
تم	t̪ ʊ m
تمام	t̪ ə m ɑː m
تمنا	t̪ ə m ə n n ɑː
تمنچه	t̪ ə m ə n t͡ʃ ɑː
تمھارا	t̪ ʊ mʱ ɑː ɾ ɑː
تمھیں	t̪ ʊ mʱ ẽː
تمہارا	t̪ ʊ m ɦ ɑː ɾ ɑː
تمہیں	t̪ ʊ m ɦ ẽː
تمیز	t̪ ə m iː z
تن	t̪ ə n
تنازع	t̪ ə n ɑː z oː ʔ
تندرست	t̪ ə n d̪ ʊ ɾ ʊ s t̪
تندرستی	t̪ ə n d̪ ʊ ɾ ʊ s t̪ iː
تندور	t̪ ə n d̪ uː ɾ
تنظیم	t̪ ə n z iː m
تنگ	t̪ ə ŋ ɡ
تو	t̪ uː
توبہ	t̪ ə ʊ b ɑː
توحیدیت	t̪ ɔː ɦ iː d̪ ɪ j ə t̪
تولیہ	t̪ ɔː l ɪ j ə
تولیے	t̪ ɔː l ɪ j eː
توچا	t̪ ʋ ə t͡ʃ ɑː
توہین	t̪ ɔː ɦ iː n
تڑت	t̪ ə ɽ ɪ t̪
تگنا	t̪ ɪ ɡ n ɑː
تھوک	t̪ʰ uː k
تھوکنا	t̪ʰ uː k n ɑː
تہائی	t̪ ɪ ɦ ɑː iː
تہجی	t̪ ə ɦ ə d͡ʒː iː
تیاگ	t̪ j ɑː ɡ
تیرا	t̪ eː ɾ ɑː
تیرنا	t̪ ɛː ɾ n ɑː
تیز	t̪ eː z
تیزاب	t̪ eː z aː b
تیسرا	t̪ iː s ɾ ɑː
تیمور	t̪ ɛː m uː ɾ
تین	t̪ iː n
تیکھا	t̪ iː kʰ ɑː
ثابت	s ɑː b ɪ t̪
ثبوت	s ə b uː t̪
ثروت	s ə ɾ ʋ ə t̪
ثقافت	s ə q ɑː f ə t̪
جائپھل	d͡ʒ ɑː ɪ pʰ ə l
جائیداد	d͡ʒ ɑː ɪ d̪ ɑː d̪
جادو	d͡ʒ ɑː d̪ uː
جامعہ	d͡ʒ ɑː m ɪ ʔ ɑː
جامن	d͡ʒ ɑː m ə n , d͡ʒ ɑː m ʊ n
جامنی	d͡ʒ ɑː m n iː
جاننا	d͡ʒ ɑː n n ɑː
جانور	d͡ʒ ɑː n ʋ ə ɾ
جانچنا	d͡ʒ ɑː n t͡ʃ n ɑː
جانکاری	d͡ʒ ɑː n k ɑː ɾ iː
جاپان	d͡ʒ ɑː p ɑː n
جاپانی	d͡ʒ ɑː p ɑː n iː
جبوتی	d͡ʒ ɪ b uː t̪ iː
جدا	d͡ʒ ʊ d̪ ɑː
جدید	d͡ʒ ə d̪ iː d̪
جرأت	d͡ʒ ʊ ɾ ɾ ə t̪
جراثیم	d͡ʒ ə ɾ ɑː s iː m
جرثومہ	d͡ʒ ʊ ɾ s uː m ɑː
جرمنی	d͡ʒ ə ɾ m ə n iː
جرگہ	d͡ʒ ɪ ɾ ɡ ɑː
جسور	d͡ʒ ə s uː ɾ
جشن	d͡ʒ ə ʃ ə n
جعلی	d͡ʒ ɑː l iː
جغرافیائی	d͡ʒ ʊ ɣ ɾ ɑː f ɪ j ɑː iː
جل	d͡ʒ ə l
جلانا	d͡ʒ ə l ɑː n ɑː
جلسہ	d͡ʒ ə l s ɑ ɦ
جلنا	d͡ʒ ə l n ɑː
جلوس	d͡ʒ ʊ l uː s
جمعرات	d͡ʒ ʊ m eː ɾ ɑː t̪
جمعہ	d͡ʒ ʊ m ʔ ɑː
جمہوریت	d͡ʒ ə m ɦ uː ɾ ɪ j ə t̪
جمہوریہ	d͡ʒ ʊ m ɦ uː ɾ ɪ j ɑː
جن	d͡ʒ ɪ n n
جنت	d͡ʒ ə nː ə t̪
جنتی	d͡ʒ ə nː ə t̪ iː
جنرل	d͡ʒ ə n ɾ ə l
جنگل	d͡ʒ ə ŋ ɡ ə l
جنیئو	d͡ʒ ə n eː uː
جوا	d͡ʒ ʊ ɑː
جواب	d͡ʒ ə ʋ ɑː b
جوانی	d͡ʒ ə ʋ ɑː n iː
جوت	d͡ʒ oː t̪
جور	d͡ʒ ʋ ə ɾ
جوگی	d͡ʒ oː ɡ iː
جوں	d͡ʒ ũː
جوہر	d͡ʒ ɔː ɦ ə ɾ
جوہری	d͡ʒ ɔː ɦ ɾ iː
جٹا	d͡ʒ ə ʈ ɑː
جپنا	d͡ʒ ə p n ɑː
جڑ	d͡ʒ ə ɽ
جڑواں	d͡ʒ ʊ ɽ ʋ ɑ̃ː
جگاڑ	d͡ʒ ʊ ɡ ɑː ɽ
جگنو	d͡ʒ ʊ ɡ n uː
جھانجھ	d͡ʒʱ ɑ̃ː d͡ʒʱ
جھنڈا	d͡ʒʱ ə n ɖ ɑː
جہاز	d͡ʒ ə ɦ ɑː z
جہازی	d͡ʒ ə ɦ ɑː z iː
جہنم	d͡ʒ ə ɦ ə n n ə m
جی	d͡ʒ iː
جیبھ	d͡ʒ iː bʱ
جیت	d͡ʒ iː t̪
جیش	d͡ʒ æː ʃ
جیل	d͡ʒ eː l
جیوتی	d͡ʒ j oː t̪ iː
جیون	d͡ʒ iː ʋ ə n
حالانکہ	ɦ ɑː l ɑ̃ː k iː
حبش	ɦ ə b ə ʃ
حبقوق	ɦ ə b ə q q uː q
حج	ɦ ə d͡ʒ d͡ʒ
حجام	ɦ ə d͡ʒ d͡ʒ ɑː m
حراست	ɦ ɪ ɾ ɑː s ə t̪
حضور	ɦ ʊ z uː ɾ
حفاظت	ɦ ɪ f ɑː z ə t̪
حقوق	ɦ ʊ q uː q
حقیقت	ɦ ə q iː q ə t̪
حلال	ɦ ə l ɑː l
حلقہ	ɦ ə l q ə
حملہ	ɦ ə m l ɑː
حنا	ɦ ɪ n ɑː
حویلی	ɦ ə ʋ eː l iː
حکومت	ɦ ʊ k uː m ə t̪
حیات	ɦ ə j ɑː t̪
حیاتیات	ɦ ə j ɑː t̪ ɪ j ɑː t̪
حیران	ɦ ɛː ɾ ɑː n
حیوانیات	ɦ ɛː ʋ ɑː n ɪ j ɑː t̪
خاتمہ	x ɑː t̪ ɪ m ə
خاتون	x ɑː t̪ uː n
خادم	x ɑː d̪ ɪ m
خارجہ	x ɑː ɾ ɪ d͡ʒ ɑː
خاصا	x ɑː s ɑː
خاصی	x ɑː s iː
خالق	x ɑː l ɪ q
خاموش	x ɑː m oː ʃ
خانساماں	x ɑː n s ɑː m ɑ̃ː
خانہ	x ɑː n ɑː
خاکسار	x ɑː k s ɑː ɾ
خاکستری	x ɑː k ɪ s t̪ ə ɾ iː
خبر	x ə b ə ɾ
خدا	x ʊ d̪ ɑː
خداوند	x ʊ d̪ ɑː ʋ ə n d̪
خدمت	x ɪ d̪ m ə t̪
خراش	x ə ɾ ɑː ʃ
خربوزہ	x ə ɾ b uː z ɑː
خرگوش	x ə ɾ ɡ oː ʃ
خریدنا	x ə ɾ iː d̪ n ɑː
خریدوانا	x ə ɾ iː d̪ ʋ ɑː n ɑː
خزاں	x ɪ z ɑ̃ː
خسارہ	x ɪ s ɑː ɾ ɑː ɦ
خسرہ	x ə s ɾ ɑː
خصوصا	x ʊ s uː s ə n
خلاف	x ɪ l ɑː f
خلافت	x ɪ l ɑː f ə t̪
خلفا	x ʊ l ə f ɑː
خلق	x ə l q
خلیج	x ə l iː d͡ʒ
خلیفہ	x ə l iː f ɑː ɦ
خنجر	x ə n d͡ʒ ə ɾ
خواب	x ɑː b
خواتین	x ə w ɑː t̪ iː n
خواجہ	x ɑː d͡ʒ ɑː
خواہ	x ɑː ɦ
خواہش	x ɑː ɦ ɪ ʃ
خوبانی	x uː b ɑː n iː
خوبصورت	x uː b s uː ɾ ə t̪
خود	x ʊ d̪
خودمختاری	x ʊ d̪ m ʊ x t̪ ɑː ɾ iː
خودکش	x ʊ d̪ k ʊ ʃ
خودکشی	x ʊ d̪ k ʊ ʃ iː
خوراک	x ʊ ɾ ɑː k
خوش	x ʊ ʃ
خوشی	x ʊ ʃ iː
خوف	x ɔː f
خون	x uː n
خیر	x ɛː ɾ
داخلہ	d̪ ɑː x ɪ l ə
داردر	d̪ ɑː ɾ ɪ d̪ ɾᵊ
داستان	d̪ ɑː s t̪ ɑ̃ː
داعش	d̪ ɑː ʔ ɪ ʃ
داغ	d̪ ɑː ɣ
دام	d̪ ɑː m
دانت	d̪ ə n t̪
دانش	d̪ ɑː n ɪ ʃ
داڑم	d̪ ɑː ɽ ɪ m
دایاں	d̪ ɑː j ɑ̃ː
دبئی	d̪ ʊ b ə iː
دباؤ	d̪ ə b ɑː oː
دجلہ	d̪ ə d͡ʒ l ɑː
درخت	d̪ ə ɾ ə x t̪
درود	d̪ ʊ ɾ uː d̪
دس	d̪ ə s
دسواں	d̪ ə s ʋ ɑ̃ː
دشت	d̪ ə ʃ t̪
دشمن	d̪ ʊ ʃ m ə n
دعا	d̪ ʊ ʔ ɑː
دفعہ	d̪ ə f ʔ ɑː
دفنانا	d̪ ə f n ɑː n ɑː
دل	d̪ ɪ l
دلربا	d̪ ɪ l ɾ ʊ b ɑː
دلچسپ	d̪ ɪ l t͡ʃ ə s p
دلی	d̪ ɪ lː iː
دمشق	d̪ ə m ɪ ʃ q
دن	d̪ ɪ n
دو	d̪ oː
دودھ	d̪ uː d̪ʱ
دورلیکھ	d̪ uː ɾ l eː kʰ
دوزخ	d̪ oː z ə x
دوستانہ	d̪ oː s t̪ ɑː n ɑː
دوسرا	d̪ uː s ɾ ɑː
دوش	d̪ oː ʃ
دونا	d̪ uː n ɑː
دوگنا	d̪ oː ɡ ʊ n ɑː
دکھ	d̪ ʊ kʰ
دکھانا	d̪ ɪ kʰ ɑː n ɑː
دگنا	d̪ ʊ ɡ n ɑː
دھات	d̪ʱ ɑː t̪
دھارا	d̪ʱ ɑː ɾ ɑː
دھاندل	d̪ʱ ɑː n d̪ ə l
دھاندلی	d̪ʱ ɑː n d̪ l iː
دھرتی	d̪ʱ ə ɾ t̪ iː
دھرم	d̪ʱ ə ɾ m
دھمال	d̪ʱ ə m m ɑː l
دھماکہ	d̪ʱ ə m ɑː k ɑː ɦ
دھن	d̪ʱ ʊ n
دھواں	d̪ʱ uː ɑ̃ː
دھوج	d̪ʱ ʋ ə d͡ʒ
دھوسر	d̪ʱ uː s ə r
دھول	d̪ʱ uː l
دھونا	d̪ʱ uː n ɑː
دھوپ	d̪ʱ uː p
دھیریہ	d̪ʱ ɛː ɾ jᵊ
دہلی	d̪ ɛ ɦ l iː
دیا	d̪ ɪ j ɑː
دیروز	d̪ iː ɾ oː z
دیش	d̪ eː ʃ
دینا	d̪ eː n ɑː
دینے	d̪ eː n eː
دیوانہ	d̪ iː ʋ ɑː n ə
دیوبندی	d̪ eː ʋ b ə n d̪ iː
دیوناگری	d̪ eː ʋ n ɑː ɡ ɾ iː
دیپک	d̪ iː p ə k
دیپکا	d̪ iː p ɪ k ɑː
دیکھنا	d̪ eː kʰ n ɑː
ذائقہ	z ɑː j q ɑː
ذات	z ɑː t̪
ذرہ	z ə rː ə
ذریعہ	z ə ɾ ɪ j ə
ذلت	z ɪ lː ə t̪
ذلیل	z ə l iː l
ذوق	z ɔː q
رائے	ɾ ɑː j
رابطہ	ɾ ɑː b t̪ ɑː
رات	ɾ ɑː t̪
راج	ɾ ɑː d͡ʒ
راجا	ɾ ɑː d͡ʒ ɑː
راستہ	ɾ ɑː s t̪ ə
راضی	ɾ ɑː z iː
رامائن	ɾ ɑː m ɑː j ə n
راکٹ	ɾ ɑː k ɪ ʈ
راکھ	ɾ ɑː kʰ
راہ	ɾ ɑː ɦ
راہب	ɾ ɑː ɦ ɪ b
راہبہ	ɾ ɑː ɦ ɪ b ɑː
راہداری	ɾ ɑː ɦ d̪ ɑː ɾ iː
ربوہ	ɾ ə b ʋ ɑː ɦ
رتن	ɾ ə t̪ ə n
رد	ɾ ə d̪ d̪
رسالہ	ɾ ɪ s ɑː l ɑː
رسول	ɾ ə s uː l
رفتار	ɾ ə f t̪ ɑː ɾ
رمضان	ɾ ə m z ɑː n
رنڈی	ɾ ə ɳ ɖ iː
رنگت	ɾ ə ŋ ɡ ə t̪
رنگولی	ɾ ə ŋ ɡ oː l iː
روانڈا	ɾ ə ʋ ɑː ɳ ɖ ɑː
روانہ	ɾ ə ʋ ɑː n ɑː
روزن	ɾ ɔː z ə n
روزہ	ɾ oː z ɑː
روس	ɾ uː s
روشنی	ɾ ɔː ʃ n iː
رونا	ɾ oː n ɑː
روپ	ɾ uː p
روچڈیل	ɾ ɔː t͡ʃ ɖ eː l
رویئہ	ɾ ə ʋ ə̯ i ɑː
رویہ	ɾ ə ʋ ə̯ i j ɑː
رکت	ɾ ə k t̪
رکشا	ɾ ə k ʂ ɑː
رہنا	ɾ ə ɦ n ɑː
ریاست	ɾ iː j ɑː s ə t̪
ریاستہا	ɾ ɪ j ɑː s ə t̪ ɦ ɑː
ریاضی	ɾ ɪ j ɑː z iː
ریختہ	ɾ eː x t̪ ɑː
ریشم	ɾ eː ʃ ə m
ریپھ	ɾ eː pʰ
ریچھ	ɾ iː t͡ʃʰ
زبان	z ʊ b ɑː n
زخم	z ə x m
زندگی	z ɪ n d̪ ə ɡ iː
زندہ	z ɪ n d̪ ɑː
زہر	z ə ɦ ə ɾ
زیادتی	z ɪ j ɑː d̪ t̪ iː
سؤر	s uː ə ɾ
سائز	s ɑː ɪ z
سائنس	s ɑː ɪ n s
سائنسی	s ɑː ɪ n s iː
سات	s ɑː t̪
ساتواں	s ɑː t̪ ʋ ɑ̃ː
ساتھی	s ɑː t̪ʰ iː
ساحل	s ɑː ɦ ɪ l
سازش	s ɑː z ɪ ʃ
سالگرہ	s ɑː l ɡ ɪ ɾ ə ɦ
سانولا	s ɑ̃ː ʋ l ɑː
سانپ	s ɑ̃ː p
ساڑی	s ɑː ɽ iː
سبد	s ə b ʊ d̪
سبزی	s ə b z iː
سبھا	s ə bʱ ɑː
سدابہار	s ə d̪ ɑː b ə ɦ ɑː ɾ
سدھارنا	s ʊ d̪ʱ ɑː ɾ n ɑː
سراب	s ə ɾ ɑː b
سرحد	s ə ɾ ɦ ə d̪
سردیاں	s ə ɾ d̪ ɪ j ɑ̃ː
سرسوتی	s ə ɾ ə s ʋ ə t̪ iː
سرسوں	s ə ɾ s õː
سرشت	s ə ɾ ɪ ʃ t̪
سرشپ	s ə ɾ ʂ ə p
سرفروش	s ə ɾ f ə ɾ oː ʃ
سرمئی	s ʊ ɾ m ə iː , s ə ɾ m ə iː
سرمہ	s ʊ ɾ m ɑː
سرور	s ʊ ɾ uː ɾ
سرونام	s ə ɾ ʋ n ɑː m
سرکار	s ə ɾ k ɑː ɾ
سرگرم	s ə ɾ ɡ ə ɾ m
سزا	s ə z ɑː
سستی	s ʊ s t̪ iː
سفارت	s ɪ f ɑː ɾ ə t̪
سفارتخانہ	s ɪ f ɑː ɾ ə t̪ x ɑː n ɑː
سفر	s ə f ə ɾ
سفید	s ə f eː d̪
سلاح	s ɪ l ɑː
سلام	s ə l ɑː m
سلجوق	s ə l d͡ʒ uː q
سلجوقی	s ə l d͡ʒ uː q iː
سمئے	s ə m ə j
سماس	s ə m ɑː s
سماعت	s ə m ɑː ʔ ə t̪
سماچار	s ə m ɑː t͡ʃ ɑː ɾ
سمجھدار	s ə m ə d͡ʒʱ d̪ ɑː ɾ
سمجھنا	s ə m ə d͡ʒʱ n ɑː
سمراٹ	s ə m ɾ ɑː ʈ
سمرتی	ɪ s m ɾ ɪ t̪ iː
سموسہ	s ə m oː s ɑː
سمپرداے	s ə m p ɾ ə d̪ ɑː eː
سمکھ	s ə m m ʊ kʰ
سناتن	s ə n ɑː t̪ ə n
سنترا	s ə n t̪ ɾ ɑː
سنجها	s ə n d͡ʒʱ ɑː
سندر	s ʊ n d̪ ə ɾ
سندھ	s ɪ n d̪ʱ
سنسکرت	s ə n s k ɾ ɪ t̪
سننا	s ʊ n n ɑː
سنگاپور	s ɪ ŋ ɡ ɑː p uː ɾ
سنگھ	s ɪ̃ ŋ ɡʱ
سنہ	s ɪ̃ ŋ ɦ
سنیوگ	s ə̃ j oː ɡ
سوادو	s ʋ ɑː d̪ uː
سوانگ	s ʋ ɑː ŋ ɡ
سواگت	s ʋ ɑː ɡ ə t̪
سوتیلا	s ɔː t̪ eː l ɑː
سوستک	s ʋ ə s t̪ ɪ k
سوغات	s ɔː ɣ ɑː t̪
سونا	s uː n ɑː
سويمور	s ʋ ə j ə m ʋ ə ɾ
سوچنا	s oː t͡ʃ n ɑː
سوکھا	s uː kʰ ɑː
سپاہی	s ɪ p ɑː ɦ iː
سڑک	s ə ɽ ə k
سکنا	s ə k n ɑː
سہمانا	s ə ɦ m ɑː n ɑː
سہمنا	s ə ɦ ə m n ɑː
سہواس	s ə ɦ ʋ ɑː s
سیاست	s ɪ j ɑː s ə t̪
سیاستدان	s ɪ j ɑː s ə t̪ d̪ ɑː n
سیر	s ɛː ɾ
سینکڑا	s ɛː ŋ k ɽ ɑː
سینگ	s iː ŋ ɡ
سینیٹر	s iː n eː ʈ ə ɾ
سیکھنا	s iː kʰ n ɑː
سے	s eː
شادی	ʃ ɑː d̪ iː
شارجہ	ʃ ɑː ɾ d͡ʒ ɑː ɦ
شاستر	ʃ ɑː s t̪ ə ɾ
شاعر	ʃ ɑː j ə ɾ
شاعرہ	ʃ ɑː j ɾ ɑː
شاعری	ʃ ɑː j ɾ iː
شام	ʃ ɑː m
شاپر	ʃ ɑː p ə ɾ
شاہراہ	ʃ ɑː ɦ ɾ ɑː ɦ
شاہی	ʃ ɑː ɦ iː
شبھ	ʃ ʊ bʱ
شترو	ʃ ə t̪ ɾ uː
شجر	ʃ ə d͡ʒ ə ɾ
شخص	ʃ ə x s
شراب	ʃ ə ɾ ɑː b
شرک	ʃ ɪ ɾ k
شرکرا	ʃ ə ɾ k ə ɾ ɑː
شریر	ʃ ə ɾ iː ɾ
شریعت	ʃ ə ɾ iː ʔ j ə t̪
شرینگر	ʃ ɾ iː n ə ɡ ə ɾ
ششن	ʃ ɪ ʃ n
شعر	ʃ eː ɾ
شناخت	ʃ ɪ n ɑː x t̪
شنتانو	ʃ ə n t̪ ə n uː
شوق	ʃ ɔː q
شکایت	ʃ ɪ k ɑː j ə t̪
شکتی	ʃ ə k t̪ iː
شکریہ	ʃ ʊ k ɾ ɪ j ɑː
شہر	ʃ ɛ ɦ ɛ ɾ
شہزادہ	ʃ ə ɦ z ɑː d̪ ɑː
شہلا	ʃ ə ɦ l ɑː
شیر	ʃ iː ɾ
شیشہ	ʃ iː ʃ ɑː
شیفیلڈ	ʃ ɛː f iː l ɖ
شیو	ʃ iː ʋ
صائب	s ɑː ɪ b
صابر	s ɑː b ɪ ɾ
صابن	s ɑː b ʊ n
صاحب	s ɑː ɦ ɪ b
صارف	s ɑː ɾ ɪ f
صارفین	s ɑː ɾ ɪ f iː n
صبح	s ʊ b ɦ
صحافی	s ɪ ɦ ɑː f iː
صحت	s ɪ ɦ ə t̪
صحیح	s ə ɦ iː
صفائی	s ɪ f ɑː iː
صفحہ	s ə f ɦ ɑː
صفرواں	s ɪ f ə ɾ ʋ ɑ̃ː
صلیب	s ə l iː b
ضرور	z ə ɾ uː ɾ
ضمانت	z ə m ɑː n ə t̪
طبلہ	t̪ ə b l əᵊ
طبیعت	t̪ ə b iː j ə t̪
طبیعیات	t̪ ə b iː ʔ j ɑː t̪
طرح	t̪ ə ɾ ɦ
طلاق	t̪ ə l ɑː q
طور	t̪ ɔː ɾ
طوفان	t̪ uː f ɑː n
عابد	ʔ ɑː b ɪ d̪
عام	ɑː m
عبادت	ɪ b ɑː d̪ ə t̪
عبرانی	ɪ b ɾ ɑː n iː
عبری	ɪ b ɾ iː
عجائب	ə d͡ʒ ɑː ɪ b
عجائبات	ə d͡ʒ ɑː ɪ b ɑː t̪
عجوبہ	ə d͡ʒ uː b ɑː
عجیب	ə d͡ʒ iː b
عراق	ɪ ɾ ɑː q
عرض	ə ɾ z
عزیز	ə z iː z
عشق	ɪ ʃ q
عطر	ʔ ɪ t̪ ɾ
عقل	ʔ ə q l
علاج	ʔ ɪ l ɑː d͡ʒ
علم	ɪ l m
علمیات	ɪ l m ɪ j ɑː t̪
علوم	ʔ ʊ l uː m
عمان	ʔ o m ɑː n
عمل	ə m ə l
عموما	ʊ m uː m ə n
عنابی	ʊ n n ɑː b iː , ə n ɑː b iː
عنب	ɪ n eː b
عوام	ə ʋ ɑː m
عورت	ɔː ɾ ə t̪
عیادت	ə j ɑː d̪ ə t̪
عیاشی	ʔ ə̯ i j ɑː ʃ iː
عیسیٰ	iː s ɑː
غرناطہ	ɣ ə ɾ n ɑː t̪ ɑː ɦ
غرور	ɣ ʊ ɾ uː ɾ
غلطی	ɣ ə l ə t̪ iː
غم	ɣ ə m
غنائیت	ɣ ʊ n n ɑː iː j ə t̪
غنچہ	ɣ ʊ n t͡ʃ ɑː
غنڈہ	ɣ ʊ n ɖ ɑː
غنہ	ɣ ʊ n n ə
غیر	ɣ ɛː ɾ
غیرت	ɣ ɛː ɾ ə t̪
فادر	f ɑː d̪ ə ɾ
فارسی	f ɑː ɾ s iː
فالحال	f ɪ l ɦ ɑː l
فالسئی	f ɑː l s ə iː
فالسہ	f ɑː l s ɑː
فانی	f ɑː n iː
فخر	f ə x ɾ
فرانس	f ɾ ɑː n s
فرضی	f ə ɾ z iː
فرمائش	f ə ɾ m ɑː ɪ ʃ
فرمانا	f ə ɾ m ɑː n ɑː
فطرت	f ɪ t̪ ɾ ə t̪
فلسطین	f ɪ l ɪ s t̪ iː n
فلپائن	f ɪ l ɪ p ɑː ɪ n
فلک	f ə l ə k
فلکیات	f ə l k iː j ɑː t̪
فوج	f ɔː d͡ʒ
فورا	f ɔː ɾ ə n
فون	f ō n
فکر	f ɪ k ɾ
فیروزی	f eː ɾ oː z iː
فیصد	f iː s ə d̪
قابض	q ɑː b ɪ z
قابل	q ɑː b ɪ l
قابلیت	q ɑː b l ɪ j ə t̪
قاتل	q ɑː t̪ ɪ l
قاعدہ	q ɑː ʔ ɪ d̪ ɑː ɦ
قاموس	q ɑː m uː s
قبض	q ə b ə z
قبضہ	q ə b z ə
قبول	q ʊ b uː l
قدیم	q ə d̪ iː m
قرآن	q ʊ ɾ ʔ ɑː n
قرطبہ	q ʊ ɾ t̪ ə b ɑː ɦ
قرمزی	q ɪ ɾ m ɪ z iː
قسط	q ɪ s t̪
قسمت	q ɪ s m ə t̪
ققنس	q ə q n ʊ s
قلعہ	q ɪ l ɑː
قلندر	q ə l ə n d̪ ə ɾ
قمیض	q ə m iː z
قواعد	q ə ʋ ɑː ɪ d̪
قوت	q ʊ ʋ ʋ ə t̪
قوم	q ɔː m
قومیت	q ɔː m ɪ j j ə t̪
قیادت	q ɪ j ɑː d̪ ə t̪
قیمتی	q iː m ə t̪ iː
قیمہ	q iː m ɑː
قینچی	q ɛ̃ː t͡ʃ iː
لال	l ɑː l
لامتناہی	l ɑː m ʊ t̪ ə n ɑː ɦ iː
لاپتہ	l ɑː p ə t̪ ə
لاکھ	l ɑː kʰ
لاہور	l ə ɦ oː ɾ
لتھوینیا	l ɪ t̪ʰ ʊ eː n ɪ j ɑː
لداخ	l ə d̪ː ɑː x
لدھیانہ	l ʊ d̪ʱ ɪ j ɑː n ɑː
لرزاں	l ə ɾ z ɑ̃ː
لسانیات	l ɪ s ɑː n ɪ j ɑː t̪
